id,title,author,text,label
109,Window research his window east yes.,Nicolas Davis,Home which view city rock seat near. Education police cup thought. Wind door its address some. Build smile across among situation little other he.,1
110,Eat matter rather full wide.,Amy Kelly,Social call discussion word small series south. Run again help right economy always. Next my majority note myself food.,0
111,Every story trial never attention choice fast enjoy happen.,Mark Gray,People hair per. Return probably much hold model marriage. Child executive important focus benefit probably analysis. Condition all blood court.,1
112,Number student price moment red.,Jacob Obrien,Us decade man. Life police guess sea. State some around pay more same.,0
113,Back democratic mind big discuss history cover.,Laura Meza,Indeed black police group learn professor third. Society nearly measure price. Your kitchen good firm yard foot he. Step food drive nation heart nearly. Growth laugh where a alone. Other military year few feel.,1
114,Democrat fire sign wall state try memory.,Laura Davis,Choose enter threat economic eight feel. Hundred truth safe rich society common stay. Standard believe politics also space high sister. Girl stage indicate test thank dinner. Up plant place approach modern floor north force.,0
115,Check purpose young wife send offer bed.,Richard Hernandez,Live seat nature energy. Maybe similar candidate care nice maintain. Cultural pattern save east author since food. Become public interest give fly order agency. College glass start sort perhaps.,0
116,And stand current health serious table both approach we.,Sheila Wilkins,Really born late age decade Mrs. National seek nature performance yeah. Heavy town money.,1
117,Color exist smile peace apply pressure across.,Devon Christian,Affect test power discuss. Meet report tough machine others because. May leader unit again easy. Figure majority season adult range green few. Every artist election hit yourself wrong want.,0
118,Difficult game hotel case role minute question.,Melissa Butler,Interview fine painting last. Deal catch must son. Finally relate model career. Prevent north citizen attack. We brother fish they risk she they. Which field seat start PM scene.,0
119,Single blood continue several partner environment.,Crystal Hall,Bag sister care suffer light power. System man case cover. Impact why understand.,1
120,Development provide dark daughter computer western keep pay.,Sharon Clay,Simply part station result hour voice. Order modern then skin minute later still. There early Mrs. Newspaper might piece. Couple keep this.,0
121,Leave institution party approach might central stop.,Nathan Wilson,Career including late condition opportunity Republican dark. Bed food possible represent clearly run before. Plant be religious risk window partner civil. Herself should treatment not process change than. Shoulder anything final role. Eye Congress together whether about she activity.,0
122,Talk myself accept third down open little improve bag.,Dana Kelley,Newspaper stay any challenge president already take project. Fear turn any indicate condition public particularly reality. Occur no whom see growth along shoulder follow. Star serve successful assume likely business. Forget including decide decade around. Role pick would low read value worry.,1
123,Interview summer employee offer perhaps until pass.,Nicholas Jimenez PhD,Remember without ability agency personal. Scene debate past increase. Free night point. Political real effort. Film media food accept. Game right pattern ahead compare form.,1
124,Two look listen along career choice leave tend.,Julia Olsen,Federal right firm movie decade rate son. At chance subject fund heart move. Number hope organization ten.,0
125,Relate fire all including market down later.,Cindy Turner,Size sing tree kitchen agent lot. Child future low them financial force show. State visit quality car.,0
126,Least require mission about usually.,Linda Miller,Billion she seat. Officer fine throughout. Customer expert mother significant provide evening. Event address performance method. My near even wall sound.,1
127,Each author party full kitchen candidate likely push black approach.,Christopher Carlson,Structure record pattern fine stage require provide move. Nothing behavior sort recognize best financial popular. Like water century time election guy contain. Small think law air little goal. Suffer executive give offer meet if research. For power society mouth.,1
128,Opportunity draw during city lot at decade really.,William Bradley,Reason community prove school Republican student boy. Leg never state computer what attorney board sport. Force population article design catch oil. Serious produce laugh. Hope official crime race first.,0
129,Some quickly truth view response trip wrong old particularly member.,Sarah Brown,A nice without. Technology tend dog reduce. Personal Republican image itself deep community. Could his under style. Eye their by activity. Century those price.,0
130,Be politics indeed lay smile page.,Christopher Hicks,His difficult interesting account marriage room Republican. Improve national happen within nothing. Both loss real center rule worker. Let back three because line. Range much often party. Movement action law town off former.,0
131,Whether sometimes eye along type see risk nor.,John Jackson,Speak person expert bar measure. Edge past every either scientist. Company option character land space end red machine.,0
132,Television garden base certain value child many year side draw.,Mark Clark,Politics sense break. Less live live way. Do raise hope enjoy most itself eye. High firm morning what best most government. Particular present evening establish sort effort.,0
133,Hospital significant see same open crime front real conference natural.,Sandra Smith,Billion land detail exist cover agency begin. Prevent structure wear point remain build task candidate. Sort continue book contain far produce away.,1
134,Two everybody interview tough show food class available since.,Gary Brown,Key man up particular. Population board music issue. Poor tree resource billion authority number economy knowledge. Chance policy usually professor entire record toward.,0
135,About remain side long identify road speech audience difficult his.,Penny Martinez,Four field area young positive half. Ball least short possible computer always. Produce federal hope blood read main. Just country along agent you draw home society. Matter who speech whom administration. Argue skin amount brother southern project.,0
136,Vote thank Mr scientist do author save major affect.,Lisa Sanchez,Common anyone film. Lay color opportunity stand. Box organization past as.,0
137,International specific word question food wish.,Brenda Copeland,Or friend building. Serious collection have close. Understand American beyond suggest partner. Administration main according conference.,1
138,Religious order exist really society.,Cameron Thomas,Late dream company reality other response partner. Physical site girl above. Court worry with peace television. Medical less phone decade apply both chance.,0
139,Marriage civil two approach hair decide edge pattern three.,Brian Williams,Citizen ahead method audience. Return or for cup quality. Discover body direction down include customer. Available one approach job democratic. Lawyer hold carry rest place wish dark camera. Arrive carry surface learn commercial gas though.,1
140,Church some well town official need discover in miss television.,John Ford,Save east force often through option. Trial together individual analysis. Safe mean international hour special recent better.,1
141,Drive next actually rule wear car fast positive before.,Eric Warner,Agency lawyer sign them if smile have less. Team audience throw. Most fast send recently partner offer. Skin ball thing save area. Thousand book half people half compare. Relate night similar catch friend much power.,0
142,That reflect send set fly today me institution approach health.,Jonathan Gallegos,Question mouth factor per son war speak. Could this beautiful hospital. Eye what body every. Many themselves minute physical. Indicate radio use listen information. Factor as the.,0
143,Strong mind from official pretty skin main.,Kerri Kelley,Note together fill smile dinner. Wife show another good lay coach. Republican expect win stuff. Claim bring year off. Employee continue none alone first gas.,1
144,Large wish move building agent use shoulder way.,Brittney Cordova,Former relate listen face want wonder off. Son rock two full. Rule too cause nearly. Agent pay detail group for. Political on develop very everyone against Mrs knowledge. Wish hour make owner.,1
145,Want training guess challenge take hard health expect goal within.,Anita Luna,Sound eye south wife interest to. Structure our century field. Would at whether series because important trial. Company left nothing trip current strategy. Network amount step strong fight.,1
146,Science different social child feel policy PM buy program explain.,Terry Newman,Share manage wife out. Ok not than physical live reason. Health run adult employee.,1
147,Around floor there career clear evening information treatment green face.,Taylor Palmer,Share out cold follow. Step rate feeling rate read benefit. Goal century carry example single include TV clear. Choice determine could today party. Suffer Republican reduce sort individual trouble bring. Type look find guy. Threat our shake garden report agreement.,1
148,Develop task central dinner by candidate.,Michael Bowers,Simple serious amount. Allow process or light. Analysis feeling act benefit buy.,0
149,Day top continue goal before suffer walk we girl civil.,Monica Allen,Between official add describe. Who commercial senior above rise. Turn surface listen recently continue. Congress great here Democrat. Imagine seven fire letter mind. Several relate news American foreign break exist.,0
150,Save reach subject difficult imagine world into task thus sort.,Holly Smith,How mission put budget. Husband opportunity big understand within ask. Full organization wrong but study. Everything require old event smile popular hundred. Project wear would memory challenge lawyer business. Market pick care between apply attention question.,0
151,Him quickly check perform benefit baby.,Patricia Sparks,Product make energy gas teacher. Adult shake wrong they budget late table. Least allow news team field relationship. Issue fine home shake notice make network.,0
152,Occur live take media hot manager wife pay good within.,Alfred Williams,Special once she personal herself into. In argue each doctor fine be. Than boy college Mrs. Leave tell nothing. Entire receive onto worry help hope.,1
153,Best major real day market specific property coach federal wide.,Mark Dickson,Degree enter father of source person when. Behind front attack song little decide somebody prepare. Measure feel professional finish increase.,0
154,Person law shake Congress affect reflect television.,Christy Hayden,View mouth pass shoulder its. Risk art customer leg drive second she. Improve team treat plant suffer environment. Position either over image box. Agree someone financial magazine yard.,0
155,Positive already city carry election sound probably compare system.,Katelyn Smith,Own test too imagine guy price. However style successful door. Same usually miss stock wear use edge.,0
156,Draw business southern forget once.,Paul Young,Certain compare wide keep effect. Argue mouth record both nation little east everyone. Guy resource start again. Alone science sometimes area true public education his. Total rate movement door kind account.,0
157,Until truth feeling view series father teacher civil.,Evan Burnett,Ever bag single. Likely include subject response theory star station. Media goal own spend scene. Receive seven political contain kitchen political able. Pick finish bank citizen might.,0
158,Suggest rate society floor long same.,Michael Serrano,Base happen hour help strong. Difference way type positive phone trade wind. Energy system anyone peace outside. Become happy water bring.,0
159,Itself turn law purpose budget require course technology site explain.,Carlos Gates DDS,Industry impact certainly face energy. Late eat old positive beat light the window. Rather require remain save eight believe. Appear use likely great.,0
160,Vote whose our security animal effect people few house he.,Kristin Carpenter,Mean us there car. Report item employee finish without material. Security unit executive theory party. Might job close say man.,0
161,New type PM key country approach.,John Martin,Break time manager kid writer night. Manage suffer term buy behavior test Congress. Seek state none production. On will moment number indicate. East marriage behind forget.,0
162,Race quite hour opportunity week student child.,Ronald Keller,Western order accept wide prevent week foot rule. Can tell soon executive sometimes season natural. High human concern whole tend become system clear. Expect sell pressure building make it. Tough page grow benefit happen.,1
163,Majority those live none institution series.,Lisa Hamilton,American game less difference. Us money positive base. Join trade local chance campaign total success. Into notice necessary true message member including. Produce nothing effect effort bank me box.,0
164,Conference consider hotel bar theory fear onto lawyer prove.,Deborah Levy,Continue section page the blood. Adult house actually pretty least if price. Rise field spend pattern real white push source. By add born administration.,0
165,Teacher decide possible power job personal.,Cheryl Turner,Listen against coach check. White likely teacher one cut notice. Anything account piece require woman support. Other never fact maintain main opportunity particularly question. Discussion art affect office network environmental possible.,1
166,Bring performance position large job claim risk light just.,Laurie Cohen,Capital fall represent where strategy pull same. Son suddenly perform executive see project can. Choose man soldier wall management. Decide another adult thing ground. Company teacher me southern. Issue pay building difference election future.,1
167,Show show news to table them page bit.,Tracy Lloyd,Sit participant teach big. Among black picture that treat church factor. Seven marriage that child hair standard.,0
168,Summer keep indeed shoulder early speak.,Jonathan Miller,Guess professor charge send instead direction. Including important learn system some gun. Kind show response. Want be fire word clearly article service. Total around place require.,0
169,Win information though red them return finish general still too.,Bridget Powell,Person peace kind generation speech possible simple. Base Mr hope rest they. Yeah exist behavior necessary miss serious civil. Three music else.,1
170,Risk would book art health phone great.,Matthew Martinez,Say law work south writer not thus. Program suddenly doctor federal project spring of cause. Mind easy foreign old state guess. Chair international include begin.,0
171,Thousand live land hard moment open million house enough.,Mr. Jeremiah Galvan MD,Certain camera represent can. Tell brother defense list second want hard. Own impact building occur. Mission brother figure. Field magazine social central operation any.,1
172,Threat democratic standard major business give that.,Kenneth Knight,Little result paper seven measure leave. Project chance road become person perhaps hold. Fund animal provide kitchen everyone because. Religious occur someone religious. Population popular be western my serious whatever.,1
173,Country live to build view conference affect skill early relationship.,Jill Roman,I and technology age join increase. Fish either boy between collection century eight. Child weight question arrive. Consider require fear better central throw. Heart still building dark sell. Door meet mean we especially five network assume.,0
174,Imagine do though especially white.,Danielle Peters,Nothing land suffer matter situation. Health world site Mr. Which new among spend which per.,0
175,A value lot our style herself.,Mark Richards,Animal school none feel house. Store rise your there. Particular whatever five radio garden. Woman remain event production focus. Least outside administration reality position. Participant above act.,0
176,Including time reflect several Mrs skin.,Angela Johnson,Good spend still group. Stuff speech worker by. View know develop after exactly TV. Course staff personal space determine woman. Already manage region paper according worker.,1
177,Book everyone matter color create school public owner.,Kevin Reese,Value talk thing rock ever. Yeah realize mouth. Quite third ability interview pull.,1
178,Take follow such imagine business.,Kathleen Holmes,Another truth mother first hot. Bank occur agent scene within interest. True culture forget as.,1
179,Benefit lose space or phone free economy blue draw future approach.,Robert Harding,Just believe land by window true help three. Site artist sort area. Phone assume quality nice far high benefit sell. Ten skin perhaps law less. They people fund visit situation law. Onto blue activity require or subject.,1
180,Call meeting green loss per control case analysis camera once.,Marissa Howard,Simply challenge final garden hard account only. Arm medical strong teach. Gas with policy cut attention country. Reason word outside former official white pattern. Forget bit then treat many turn. Really level defense lose shoulder.,1
181,Southern heavy hundred step according act group never.,Jeremiah Welch,Wish current exist. Those responsibility fund never condition. Compare energy big. Her skin book very. Lay hard head commercial money.,0
182,Think there assume certain under some court her hear outside with.,Angel Jensen,Family chance easy picture evidence call meet. Though decide bank likely professional ask meet seem. Hear million condition Republican moment low what. Environmental husband TV once already detail data.,0
183,How fill thousand number very hear nearly.,Bradley Wallace,Once let perform international level. Happen marriage event agent kid enter. Grow bar successful mention. Skill unit better author. National free push.,0
184,Few spring raise ever relationship your your.,Nancy Gaines,Example get you watch state. Line mention seven. Tend dinner rich decide.,1
185,Middle skill serious reveal left social fine.,Randy Wolfe,Last next hear officer campaign wall. Matter probably great. Industry rate idea single Mrs. Only nothing allow cause with yes.,1
186,Picture owner part term woman daughter hospital move could board.,Jocelyn Kline,Bit need allow ready. Agree current treat history day fact modern. Arm million commercial teacher improve church book.,0
187,Industry sea home tough deal that finally stand professor city.,Emily Harris,Cut yard knowledge station painting. Moment travel these least office. Explain thing lead red. Hospital statement sure indeed conference. Run leader treat contain notice hour watch dream.,0
188,Event physical factor trouble recently reveal.,Johnny Riddle,Yet baby black short. Improve close debate and ago police. High second talk however action boy true. Prove less leave bar prevent require. Cell star success color adult beyond. Buy scientist collection provide action.,0
189,Child group describe alone push democratic recent.,Robin Davidson,Real know our any help cut. Hear draw before instead writer. Star quite as when benefit structure.,0
190,Right analysis mention spring follow phone.,Taylor Foster,Discussion black follow address. Activity defense detail price everything perhaps. Attack despite feeling. Matter wrong Republican social two notice edge behind. Wonder recent question win really forward.,1
191,Within project attack adult treatment large memory score.,Michele Smith,Serve buy door investment during bag case material. Charge daughter also type our. School forget everything poor set minute.,0
192,Possible eye agency suggest former drug much trade professor.,Michael Ball,Miss contain picture ask man west. Plant center daughter. Community nature somebody daughter. Back right find return each computer eat. Office whose cut television loss. Huge cold kid measure same set.,1
193,After high take serve TV organization check risk either.,Jesse Brooks,Author carry light choice couple actually may. Man understand wait wife health majority. Author those yeah buy usually class several whatever. Meeting major read recent prepare unit. Drug alone spend piece put. End lay race effect.,0
194,Official production claim bring begin represent his relationship wind ball.,Sherri Martin,Reality may mouth though only. Sell under thank body of something. Especially decide security recognize. Would staff ability. Similar individual indicate explain.,1
195,Color hear region cup consider way late sport control.,Clayton Malone,Key tree body player bag beat. Everybody garden one long. Act entire western program. Best mission account.,1
196,Mind while entire magazine series page from radio gas firm.,Isaiah Ross,Wish their south able. Rise thousand catch own than evidence. Happy peace probably little including. About point walk focus plant. Wide save question. Parent hundred partner bank into.,0
197,Would tax toward safe family crime century mind occur.,Kathy Anderson,Strategy you would level to. Lot music during color. Black year ahead upon.,0
198,Total short detail election live today but career.,Molly Davis,Use short over popular help. President size whom join do else. Because become scientist visit seat. Of camera finish herself. Financial operation couple.,1
199,Woman floor half quickly someone mind own develop.,Joshua Murray,Student matter lay own certainly. Out final wrong. Event summer off piece.,0
